{
  "name": "Commerce Essentials Plugin",
  "version": "1.0.0",
  "themes": {
    "storefront": {
      "label": "Storefront",
      "css": ":root {\n  --color-scheme: light;\n  --bg: #faf9f7;\n  --surface: #ffffff;\n  --surface-2: #f0ede7;\n  --text: #251f1a;\n  --text-muted: #756b63;\n  --primary: #1f6b4f;\n  --primary-contrast: #ffffff;\n  --secondary: #bd6d2f;\n  --success: #278044;\n  --warning: #c07815;\n  --danger: #c33c45;\n  --info: #2878a5;\n  --border: #ddd6ce;\n  --focus: #3c9b76;\n  --radius: .55rem;\n  --shadow: 0 10px 26px rgba(50, 40, 30, .1);\n  --font-sans: Inter, system-ui, sans-serif;\n}"
    }
  },
  "components": {
    "card": {
      "description": "Carte produit avec image et badge de promotion.",
      "default_variant": "default",
      "required": ["content.title", "content.price"],
      "accepts_children": true,
      "variants": {
        "default-left": {
          "html": "<article class='commerce-card {{class}}'>{{#content.badge}}<span class='commerce-card__badge'>{{content.badge}}</span>{{/content.badge}}{{#content.image}}<img src='{{content.image}}' alt='{{content.image_alt}}' loading='lazy'>{{/content.image}}<div class='commerce-card__body'><h2>{{content.title}}</h2><p>{{content.text}}</p><strong>{{content.price}}</strong>{{{children}}}</div></article>",
          "css": ".commerce-card { position: relative; overflow: hidden; border: 1px solid var(--border); border-radius: var(--radius); background: var(--surface); } .commerce-card > img { width: 100%; aspect-ratio: 4 / 3; object-fit: cover; } .commerce-card__body { display: grid; gap: .6rem; padding: 1rem; } .commerce-card__body h2, .commerce-card__body p { margin: 0; } .commerce-card__body p { color: var(--text-muted); } .commerce-card__body > strong { color: var(--primary); font-size: 1.35rem; } .commerce-card__badge { position: absolute; z-index: 2; top: .6rem; left: .6rem; padding: .25rem .5rem; border-radius: 999px; background: var(--danger); color: white; font-size: .72rem; font-weight: 800; }",
          "js": ""
        },
        "default-right": {
          "html": "<article class='commerce-card {{class}}'>{{#content.badge}}<span class='commerce-card__badge'>{{content.badge}}</span>{{/content.badge}}{{#content.image}}<img src='{{content.image}}' alt='{{content.image_alt}}' loading='lazy'>{{/content.image}}<div class='commerce-card__body'><h2>{{content.title}}</h2><p>{{content.text}}</p><strong>{{content.price}}</strong>{{{children}}}</div></article>",
          "css": ".commerce-card { position: relative; overflow: hidden; border: 1px solid var(--border); border-radius: var(--radius); background: var(--surface); } .commerce-card > img { width: 100%; aspect-ratio: 4 / 3; object-fit: cover; } .commerce-card__body { display: grid; gap: .6rem; padding: 1rem; } .commerce-card__body h2, .commerce-card__body p { margin: 0; } .commerce-card__body p { color: var(--text-muted); } .commerce-card__body > strong { color: var(--primary); font-size: 1.35rem; } .commerce-card__badge { position: absolute; z-index: 2; top: .6rem; right: .6rem; padding: .25rem .5rem; border-radius: 999px; background: var(--danger); color: white; font-size: .72rem; font-weight: 800; }",
          "js": ""
        }
      },
      "defaults": {"content": {"text": "", "image": "", "image_alt": "", "badge": ""}}
    },
    "price": {
      "description": "Prix avec ancien tarif et périodicité.",
      "default_variant": "default",
      "required": ["content.value"],
      "accepts_children": false,
      "variants": {
        "default": {
          "html": "<p class='commerce-price {{class}}'>{{#content.previous}}<del>{{content.previous}}</del>{{/content.previous}}<strong>{{content.value}}</strong>{{#content.period}}<small>/ {{content.period}}</small>{{/content.period}}</p>",
          "css": ".commerce-price { display: flex; align-items: baseline; flex-wrap: wrap; gap: .4rem; margin: 0; } .commerce-price del { color: var(--text-muted); } .commerce-price strong { color: var(--primary); font-size: 1.7rem; } .commerce-price small { color: var(--text-muted); }",
          "js": ""
        }
      },
      "defaults": {"content": {"previous": "", "period": ""}}
    },
    "quantity": {
      "description": "Sélecteur de quantité avec contrôles plus et moins.",
      "default_variant": "default",
      "required": ["content.name"],
      "accepts_children": false,
      "variants": {
        "default": {
          "html": "<div class='commerce-quantity {{class}}'><button type='button' data-step='-1' aria-label='Diminuer'>−</button><input type='number' name='{{content.name}}' min='{{content.min}}' max='{{content.max}}' value='{{content.value}}' aria-label='{{content.label}}'><button type='button' data-step='1' aria-label='Augmenter'>+</button></div>",
          "css": ".commerce-quantity { display: inline-grid; grid-template-columns: 2.5rem 3.5rem 2.5rem; overflow: hidden; border: 1px solid var(--border); border-radius: var(--radius); } .commerce-quantity button, .commerce-quantity input { min-height: 2.5rem; border: 0; background: var(--surface); color: var(--text); text-align: center; } .commerce-quantity button { cursor: pointer; font-size: 1.2rem; } .commerce-quantity input { border-inline: 1px solid var(--border); appearance: textfield; }",
          "js": "document.querySelectorAll('.commerce-quantity').forEach((root) => { const input = root.querySelector('input'); root.querySelectorAll('[data-step]').forEach((button) => button.addEventListener('click', () => { const next = Math.min(Number(input.max), Math.max(Number(input.min), Number(input.value) + Number(button.dataset.step))); input.value = String(next); input.dispatchEvent(new Event('change', { bubbles: true })); })); });"
        }
      },
      "defaults": {"content": {"min": "1", "max": "99", "value": "1", "label": "Quantité"}}
    },
    "cart-button": {
      "description": "Bouton ajout panier émettant l'événement cart:add.",
      "default_variant": "primary",
      "required": ["content.text", "content.product_id"],
      "accepts_children": false,
      "variants": {
        "primary": {
          "html": "<button class='commerce-cart-button {{class}}' type='button' data-product-id='{{content.product_id}}'>{{content.text}}</button>",
          "css": ".commerce-cart-button { display: inline-flex; justify-content: center; padding: .65rem 1rem; border: 0; border-radius: var(--radius); background: var(--primary); color: var(--primary-contrast); font-weight: 750; cursor: pointer; } .commerce-cart-button.is-added { background: var(--success); }",
          "js": "document.querySelectorAll('.commerce-cart-button').forEach((button) => button.addEventListener('click', () => { button.classList.add('is-added'); const original = button.textContent; button.textContent = 'Ajouté ✓'; button.dispatchEvent(new CustomEvent('cart:add', { bubbles: true, detail: { productId: button.dataset.productId } })); setTimeout(() => { button.classList.remove('is-added'); button.textContent = original; }, 1200); }));"
        }
      }
    }
  },
  "shortcuts": {
    "class": {
      "sale-ring": "outline: 3px solid var(--danger); outline-offset: 3px;",
      "product-hover": "transition: transform .2s ease, box-shadow .2s ease;",
      "price-highlight": "color: var(--primary); font-size: 1.5rem; font-weight: 800;",
      "compact-product": "max-width: 18rem;"
    }
  }
}
